{
  "schema_version": 1,
  "id": "skill-interconnect",
  "type": "skill",
  "title": "Interconnect architecture and AMBA",
  "summary": "Hardware-domain expertise applied to interconnect software tooling.",
  "organization": null,
  "role": null,
  "dates": {
    "start": null,
    "end": null,
    "ongoing": false,
    "as_of": "2026-10-29",
    "note": "No additional date precision is supplied. Skill usage belongs to associated projects and employment periods; no years of proficiency are inferred."
  },
  "technologies": [
    "AMBA",
    "SoC",
    "CMN",
    "NCI",
    "AMBA AXI",
    "ACE-Lite",
    "AHB"
  ],
  "competencies": [
    "interconnect architecture",
    "topology",
    "routing",
    "DRC"
  ],
  "tags": [
    "skill",
    "Interconnect architecture and AMBA",
    "owo"
  ],
  "related": [
    "project-interconnect-architect",
    "project-arachne-noc",
    "accomplishment-interconnect-safety-parity",
    "accomplishment-interconnect-hang-detection"
  ],
  "facts": [
    {
      "id": "context",
      "text": "Applied interconnect topology, routing, domains, memory maps and protocol constraints in full-stack EDA tooling.",
      "status": "reported",
      "visibility": "public",
      "evidence": [
        {
          "source_id": "src-ia-analysis",
          "locator": "L369-L374"
        },
        {
          "source_id": "src-ia-implementation-2026-10-27",
          "locator": "L1937-L2076"
        }
      ]
    },
    {
      "id": "source-listed",
      "text": "The LinkedIn export lists System on a Chip, Interconnect Architecture and AMBA Protocols among top skills.",
      "status": "reported",
      "visibility": "private",
      "evidence": [
        {
          "source_id": "src-linkedin-text",
          "locator": "L14-L17"
        }
      ]
    },
    {
      "id": "applied-domain",
      "text": "Translated routing, clock crossings, width conversion, resource-plane/credit constraints and memory alignment into validated configuration and migration workflows.",
      "status": "reported",
      "visibility": "public",
      "evidence": [
        {
          "source_id": "src-ia-research-findings-2026-10-27",
          "locator": "L252-L252"
        },
        {
          "source_id": "src-ia-implementation-2026-10-27",
          "locator": "L1937-L2076"
        }
      ]
    },
    {
      "id": "protocol-safety-models",
      "text": "Applied AXI/ACE-Lite and AHB handshake, request/response, byte-validity and user-sideband semantics to safety verification models and generated testbench integration.",
      "status": "reported",
      "visibility": "public",
      "evidence": [
        {
          "source_id": "src-arachne-findings-2026-10-29",
          "locator": "L33-L36"
        },
        {
          "source_id": "src-arachne-findings-2026-10-29",
          "locator": "L59-L62"
        },
        {
          "source_id": "src-arachne-findings-2026-10-29",
          "locator": "L75-L78"
        },
        {
          "source_id": "src-arachne-authored-diffs-2026-10-29",
          "locator": "L6250-L6366"
        }
      ]
    }
  ],
  "notes": [
    "No proficiency score, years-of-experience count, current specialization or vendor certification is inferred. Use the linked project context to judge depth and recency.",
    "2026-10-27 local Git/source research supplements prior evidence. Authorship supports attributable implementation; shared components and later colleague changes retain separate ownership. No employer tests were rerun."
  ]
}
