{
  "schema_version": 1,
  "id": "project-ia-mcp",
  "type": "project",
  "title": "Interconnect Architect MCP capability pack",
  "summary": "Internal Model Context Protocol tooling that translates engineering intent into controlled interconnect backend operations.",
  "organization": "Arm",
  "role": "Software engineer and individual contributor",
  "dates": {
    "start": "2026-04-21",
    "end": null,
    "ongoing": true,
    "as_of": "2026-10-27",
    "note": "First inspected milestone: 2026-04-21. See facts for earlier/later feature stages; this is neither proof of first-ever work nor a formal role/leadership start or shipped release date."
  },
  "technologies": [
    "Python",
    "Model Context Protocol",
    "Codex",
    "YAML"
  ],
  "competencies": [
    "Agent-tool integration",
    "Backend architecture",
    "Engineering automation"
  ],
  "tags": [
    "AI-engineering",
    "MCP",
    "interconnect",
    "developer-tools",
    "ai-planning",
    "ai-runtime",
    "release"
  ],
  "related": [
    "project-interconnect-architect",
    "exp-arm-senior"
  ],
  "facts": [
    {
      "id": "purpose",
      "text": "Built ia-mcp, an internal Python MCP interface used by several engineers to translate interconnect intent into backend API calls with typed plans, checkpoints, semantic validation and backend fallback.",
      "status": "confirmed",
      "visibility": "public",
      "evidence": [
        {
          "source_id": "src-runtime",
          "locator": "L12-L18"
        }
      ]
    },
    {
      "id": "ownership",
      "text": "Introduced the ia-mcp capability pack and developed its planning, execution, compatibility, packaging and acceptance infrastructure.",
      "status": "reported",
      "visibility": "public",
      "evidence": [
        {
          "source_id": "src-ia-analysis",
          "locator": "L309-L327"
        },
        {
          "source_id": "src-ia-implementation-2026-10-27",
          "locator": "L3602-L3911"
        }
      ]
    },
    {
      "id": "goals",
      "text": "Future goals include configuration-generation coverage/feature testing and potentially replacing configuration-generation tools.",
      "status": "confirmed",
      "visibility": "private",
      "evidence": [
        {
          "source_id": "src-adoption",
          "locator": "L14-L20"
        }
      ]
    },
    {
      "id": "source-history",
      "text": "Introduced the internal MCP capability pack in April 2026 and developed transactional planning, compatibility and packaging through later 2026 changes; the inspected code supports bounded engineering automation rather than a new model execution loop.",
      "status": "reported",
      "visibility": "private",
      "evidence": [
        {
          "source_id": "src-ia-research-findings-2026-10-27",
          "locator": "L448-L448"
        },
        {
          "source_id": "src-ia-implementation-2026-10-27",
          "locator": "L3602-L3911"
        },
        {
          "source_id": "src-ia-implementation-2026-10-27",
          "locator": "L3912-L4113"
        },
        {
          "source_id": "src-ia-implementation-2026-10-27",
          "locator": "L4114-L4320"
        }
      ]
    }
  ],
  "notes": [
    "Internal engineering use is established qualitatively; exact adoption counts, release dates, productivity savings and external deployment are not established.",
    "Does not establish unrestricted autonomous generation, general autonomous DRC repair, a hosted LLM service or authorship of Codex.",
    "2026-10-27 local Git/source research supplements prior evidence. Authorship supports attributable implementation; shared components and later colleague changes retain separate ownership. No employer tests were rerun."
  ]
}
