{
  "schema_version": 1,
  "id": "exp-arm-iot-intern",
  "type": "experience",
  "title": "IoT Engineering Intern",
  "summary": "Internship initiating the FPGA test shield and contributing Mbed OS I2C and cryptography integration.",
  "organization": "Arm",
  "role": "IoT Engineering Intern",
  "dates": {
    "start": "2018-05",
    "end": "2018-08",
    "ongoing": false,
    "as_of": "2026-10-27",
    "note": "Employment dates are supplied at month precision. Ongoing status is a source-era snapshot, not a claim about future employment."
  },
  "technologies": [],
  "competencies": [],
  "tags": [
    "employment",
    "Arm",
    "Austin"
  ],
  "related": [
    "project-mbed-fpga-test-shield",
    "accomplishment-mbed-i2c-crypto"
  ],
  "facts": [
    {
      "id": "employment",
      "text": "IoT Engineering Intern at Arm in Austin, Texas, 2018-05 to 2018-08.",
      "status": "reported",
      "visibility": "public",
      "evidence": [
        {
          "source_id": "src-legacy-profile",
          "locator": "L54-L58"
        }
      ]
    }
  ],
  "notes": []
}
